### ISSUE TITLE
Satellite sources of DAB feeds

### ISSUE THREAD

**Issue by lars18th** [piratfm/eti-tools#12]
Hi,

I suggest to update the README.md incorporating a list of available satellite sources of ETI-NA bitstreams.

For example, you can get a list from: https://radioempfang.digital/dab-ueber-satellit/

I hope this helps!
Regards.

**Comment by andimik** [comment]
Please help yourself and send a Pull request. This is very easy! Even I do that (and am not a programmer)

**Comment by lars18th** [comment]
Hi @andimik ,

OK. I'll try.

At time, this the formated Table with the data that I can confirm:

Stream Name | Sat | Freq | SR/FEC | Modulation | PID | SID | Check
-- | -- | -- | -- | -- | -- | -- | --
D1 DAB | 9.0ºE | 11727V | 27500 3/4 | QPSK/DVB-S | 1062 | ?? | Pending
SDL nATL | 9.0ºE | 11727V | 27500 3/4 | QPSK/DVB-S | 1063 | ?? | Pending
BBC DAB | 4.5ºE | 12303H | 25546 7/8 | QPSK/DVB-S | 1061 | 70 | OK
D1 DAB | 4.5ºE | 12303H | 25546 7/8 | QPSK/DVB-S | 1062 | 60 | OK
SDL NATL | 4.5ºE | 12303H | 25546 7/8 | QPSK/DVB-S | 1063 | 80 | OK
  |   |   |   |   |   |   |

**Comment by andimik** [comment]
23,5 is very easy in case your Linux driver allows to lock. Otherwise record a TS (all PIDs) in Windows.

**Comment by lars18th** [comment]
> 23,5 is very easy in case your Linux driver allows to lock. Otherwise record a TS (all PIDs) in Windows.

23.5ºE isn't the most easy to tune with commodity hardware (SAT>IP server, Linux DVB, or STB with stream capabilities)! So, I tested 4.5ºE and it works like a charm!

I'm creating a PR with a simple guide.
Stay on hold! :smile:

**Comment by piratfm** [comment]
Hi all, there is also NRK on 1°W 10704 V 4200 MIS 171 (DVB-S2/BBFrames and GSE inside). That's can be interesting challenge to extract DAB+ from there.

**Comment by andimik** [comment]
Same for Bayerischer Rundfunk 11D on 9 East 
DAB Italia and EuroDAB are not tested so far resp. left the transponder

**Comment by piratfm** [comment]
Both streams from 23.5 are using 0x47 header only (it's simulating mpeg-ts by adding that byte). So DVB-cards must work in "budget" mode and pass all packets to the reception application. Also ts2na must have negative offset (as i remember -3 bytes).

**Comment by lars18th** [comment]
Hi,

PR created #13 . Please, review it; and modify it if you found more data. However, please check it first and publish required info/commets.

Regards.

**Comment by piratfm** [comment]
Can You add type of tuner You use to tune by using that long http string?

**Comment by lars18th** [comment]
Hi @piratfm ,

> Can You add type of tuner You use to tune by using that long http string?

It's printed! Read it, **SAT>IP**. :smile: 
This it's only the URI in satip format for _tunning_ the transporder and _filtering_ for the required pids.

In my case I use my hardware SAT>IP server (you can use too a software one, like TVHeadend, minisatip or SATPI). And with one tool I tune the mux and I do the streaming. But if your SAT>IP server supports the HTTP transport (minisatip supports it), then you can use any "http2multicast" tool to do it (like tomcast).

Regards.

**Comment by piratfm** [comment]
So it's similar to szap-s2 applications, but for network, ok.

**Comment by lars18th** [comment]
@piratfm ,

> Patch applied.

Thank you!
Then, I close this issue. :smile:

**Comment by lars18th** [comment]
Hi @andimik ,

> Same for Bayerischer Rundfunk 11D on 9 East

Please, share the info about this feed.

**Comment by newspaperman** [comment]
BR is on 7°East 12537 V 996 2/3

**Comment by lars18th** [comment]
> BR is on 7°East 12537 V 996 2/3

And you have checked it?

I don't see this feed frequency in mux lists:
- http://www.lyngsat.com/Eutelsat-7A-7B.html
- http://en.kingofsat.net/pos-7E.php

**Comment by andimik** [comment]
Try flysat ;-) 

Sorry, yes it's 7 east, not 9 East.

**Comment by lars18th** [comment]
Hi @andimik ,

> Try flysat ;-)

Thank you! :smile: 

And regarding the BR on this feed: You have check it?
And what about the other "similar" data feeds close to this? Can be 12527V also a DAB feed?

**Comment by andimik** [comment]
Check it and tell us. I don't receive this position

**Comment by lars18th** [comment]
> I don't receive this position

Me neither! :disappointed: 

We need help to test 7ºE, 23.5ºE, 1ºW. Any help?
 
And also 9ºE. My antena doesn't have sufficient signal in transponder 11727V.
So, my only option it's 12303H in 4.5ºE.

**Comment by lars18th** [comment]
Hi @piratfm,

Regarding dumps, I like to share this full MPEG-TS dump from 12303H in 4.5ºE (90 seconds of dump, filtering for only 1061, 1062 & 1063 pids):
http://www.sendspace.com/file/kv7ij3

Also, if you're the owner of this blog, please can you share it in the section "Usage examples"?
http://tipok.org.ua/node/46

Thank you!

**Comment by lars18th** [comment]
Hi,

Some of you can share captures from 9.0ºE, 23.5ºE and/or  1ºW ?

I don't have access to these orbital positions.
Thank you!

**Comment by andimik** [comment]
`$ ts2na -i 23_5_east_5c.ts -s -3 | na2ni | ni2http --list`

Rename this file to xz and extract it

[23_5_east_5c.ts.xz.zip](https://github.com/piratfm/eti-tools/files/1759631/23_5_east_5c.ts.xz.zip)

**Comment by lars18th** [comment]
Thank you @andimik !

Now we have 3 dumps:

- 4.5ºE 12303H (3 DAB streams, pids=1061,1062&1063): http://www.sendspace.com/file/kv7ij3
- 23.5ºE 12640V: https://github.com/piratfm/eti-tools/files/1759631/23_5_east_5c.ts.xz.zip
- 23.5ºE 12645V: https://github.com/piratfm/eti-tools/files/1759617/23_5_east_11d.ts.xz.zip

Perhaps it's time to include these links in the README.md. :smile: 
(Note: I can't upload my dump here because the 10MB size limit)

**Comment by lars18th** [comment]
And regarding the current Table **Satellite DAB(+) feeds** in the README.md

@andimik , please can you confirm the _parameters_ of transponders?
I'm not sure about the symbol rate and FEC.
I ask to update the table.

And someone has checked the 9.0ºE? 
If yes, please share dumps.

**Comment by andimik** [comment]
You are very exhausting

**Comment by lars18th** [comment]
Hi @andimik ,

> You are very exhausting

Sorry! But I like to update the info in the README.md and...

* http://www.flysat.com/astra3b.php: 5C is **12641** V 1342 **5/6** and 11D is 12645 V 1489 3/4.
* https://radioempfang.digital/dab-ueber-satellit/: 5C is **12640** V 1342 **3/4** and 11D is 12645 V 1489 3/4.

In order to share correct values, I only ask for confirmation (I don't receive this sat position!).

**Comment by andimik** [comment]
5C is in 5/6, but normal hardware should work with AUTO as well

**Comment by lars18th** [comment]
Updated PR: https://github.com/piratfm/eti-tools/pull/17

**Comment by andimik** [comment]
# Historical feeds from 2015

[DAB_from_4.8_east_nov_2015.ts.zip](https://github.com/piratfm/eti-tools/files/1772438/DAB_from_4.8_east_nov_2015.ts.zip)


They unfortunately ceased some weeks after I found them ... PIDs 1061 and 1062 are still there. 

Remark: Those PIDs 1063-1065 had `-s 0`, while now all have `-s 12`.

## Mux Derby 
on Astra 4.8 East 
(PID 1065)

```
$ ts2na -i DAB_from_4.8_east_nov_2015.ts -s 0 -p 1065 | na2ni | ni2http --list
WARN:  Forwarded error correction enabled
INFO:  Using pid: 0x0429 (1065)
INFO:  E1 Sync found at bit: 128, inverted: no
DEBUG: seek: B:16, b:0
DEBUG: pre-readed output 15 frames (15 bytes left):
DEBUG: MULTIFRAME FILLING: 207
INFO:  ETI Sync found at pos: 7
INFO:  ETI Multiframe sync found at blockId: 1
. (0xc1bd)
 0 :  BBC Radio Derby (0xc937) Pri subch= 5 start=  0 CUs= 96 PL=uep 3 bitrate=128
 1 :          Capital (0xc677) Pri subch= 1 start= 96 CUs= 96 PL=uep 3 bitrate=128
 2 :            Heart (0xc560) Pri subch= 4 start=192 CUs= 96 PL=uep 3 bitrate=128
 3 :  Gold Derbyshire (0xc9ce) Pri subch= 2 start=288 CUs= 96 PL=uep 3 bitrate=128
 4 : Gem 106 EastMids (0xc3ab) Pri subch= 3 start=384 CUs= 96 PL=uep 3 bitrate=128
 5 :     Smooth Radio (0xc3a2) Pri subch= 6 start=480 CUs= 58 PL=uep 3 bitrate=80

```

## Mux North Yorkshire
on Astra 4.8 East 
(PID 1064)

```
$ ts2na -i DAB_from_4.8_east_nov_2015.ts -s 0 -p 1064 | na2ni | ni2http --list
WARN:  Forwarded error correction enabled
INFO:  Using pid: 0x0428 (1064)
INFO:  E1 Sync found at bit: 320, inverted: no
DEBUG: seek: B:40, b:0
DEBUG: pre-readed output 14 frames (23 bytes left):
DEBUG: MULTIFRAME FILLING: 206
INFO:  ETI Sync found at pos: 2
INFO:  ETI Multiframe sync found at blockId: 12
.North Yorkshire (0xc1b6)
 0 :   BBC Radio York (0xcc37) Pri subch= 1 start=  0 CUs= 96 PL=uep 3 bitrate=128
 1 :     More Minster (0xc7d0) Pri subch= 2 start= 96 CUs= 96 PL=uep 3 bitrate=128
 2 :      Stray Extra (0xc8d0) Pri subch= 3 start=192 CUs= 96 PL=uep 3 bitrate=128
 3 :  YORKSHIRE COAST (0xcbd0) Pri subch= 4 start=288 CUs= 96 PL=uep 3 bitrate=128
 4 :          Capital (0xc370) Pri subch= 5 start=384 CUs= 84 PL=uep 3 bitrate=112
 5 :     Smooth Radio (0xcace) Pri subch= 6 start=468 CUs= 84 PL=uep 3 bitrate=112
 6 :  Radio Yorkshire (0xc2ce) Pri subch= 8 start=552 CUs= 84 PL=uep 3 bitrate=112
 7 :       Vale Radio (0xc0d7) Pri subch= 7 start=636 CUs= 48 PL=uep 3 bitrate=64
```

## Mux Wales 
on Astra 4.8 East 
(PID 1063)

```
$ ts2na -i DAB_from_4.8_east_nov_2015.ts -s 0 -p 1063 | na2ni | ni2http --list
WARN:  Forwarded error correction enabled
INFO:  Using pid: 0x0427 (1063)
INFO:  E1 Sync found at bit: 192, inverted: no
DEBUG: seek: B:24, b:0
DEBUG: pre-readed output 15 frames (7 bytes left):
DEBUG: MULTIFRAME FILLING: 207
INFO:  ETI Sync found at pos: 5
INFO:  ETI Multiframe sync found at blockId: 19
. (0xc1bf)
 0 :  BBC Radio Wales (0xc838) Pri subch= 1 start=  0 CUs= 96 PL=uep 3 bitrate=128
 1 :  BBC Radio Cymru (0xc83b) Pri subch= 2 start= 96 CUs= 96 PL=uep 3 bitrate=128
 2 :          Capital (0xc573) Pri subch= 3 start=192 CUs= 84 PL=uep 3 bitrate=112
 3 :     Smooth Radio (0xc9d0) Pri subch= 4 start=276 CUs= 84 PL=uep 3 bitrate=112
 4 :     Nation Radio (0xc682) Pri subch= 5 start=360 CUs= 84 PL=uep 3 bitrate=112
 5 :     Nation Hits! (0xc784) Pri subch= 6 start=444 CUs= 84 PL=uep 3 bitrate=112

```

**Comment by rashuk** [comment]
That was most likely using sat distribution until the G.703 lines were put
in. It only makes sense to use satellite distribution if you have lots of
transmitter sites as it becomes cheaper than leased lines at some number of
them.

R.

**Comment by andimik** [comment]
You can delete 9 East, the complete package left the transponder and there is no carrier now. Just tested it.

http://www.flysat.com/e9b.php

**Comment by andimik** [comment]
The bitrate for PID 1025 on the BR 11D transponder on 7 East is less than common 2 MBit, so I wonder which system they are using.

**Comment by lars18th** [comment]
Hi @andimik ,

> You can delete 9 East, the complete package left the transponder and there is no carrier now. Just tested it

I'll prepare a PR. Thank you for testing it!

> The bitrate for PID 1025 on the BR 11D transponder on 7 East is less than common 2 MBit, so I wonder which system they are using.

If you can, please provide a full capture of this transponder. Then we can analyze it.

**Comment by andimik** [comment]
Bayerischer Rundfunk 11D is in ETI v.11, so this doesn't work with eti-tools. 

But it works with https://github.com/newspaperman/tsniv2ni

**Comment by andimik** [comment]
Here is a dump.

`$ tsniv2ni 1025 < file.ts`

[7.0E_12536V_Bayern_ETIv11.ts.zip](https://github.com/piratfm/eti-tools/files/1786782/7.0E_12536V_Bayern_ETIv11.ts.zip)

This is described here for example: http://wiki.opendigitalradio.org/Ensemble_Transport_Interface So, there is no need to use the full 2 MBit.

**Comment by lars18th** [comment]
Hi @andimik ,

Thank you! :smile: 
I'll try to incorporate the code of "tsniv2ni" in the current "ts2na"... but in this case (when ETI-NI(v11), the output will be ETI-NI instead of ETI-NA.

Regards.

**Comment by andimik** [comment]
Why? There is already a tool for it.

**Comment by lars18th** [comment]
Hi @andimik ,

> Why? There is already a tool for it.

I found some reasons:

1. This other tool is unmaintained.
2. You can receive any feed with the same tool regardless of the encapsulation format.
3. We will improve the `ts2na` for a better error handling.
4. This ETI-NI(v11) is only _another_ encapsulation format, just others already supported by `ts2na`.

So, I feel it's good to add this function (de-encapsulate ETI-NI(v11)) inside the current `ts2na`.
Don't you think so?

**Comment by andimik** [comment]
> This other tool is unmaintained

But there is no need to change it.  It will EXACTLY do what we expect.

**Comment by lars18th** [comment]
Hi @piratfm ,

> ts2na tool outputs NA format, just like on it's name.

Yes. But let me to comment something about this:
- This is because at time only ETI-NA streams are found in MPEG-TS. Using my recently "na2ts" we can encapsulate too ETI-NI in MPEG-TS. So, in fact, these tools can work with _any_ ETI format (NA, NI, NI-v11). I don't see any drawback in using the same tool for de-encapsulatinput multiple subformats.

> tsniv2ni - does the job from it's name, we can ask @newspaperman to embed his tool to eti-tools (and rewrite it to C with zeromq support as well).

For me is quite easy to enhance the current "ts2na" (or "ts2eti" if you prefer) with the option to de-encapsulate in the same way as does the "tsniv2ni" tool. And if you'll work in adding ZeroMQ support to "ts2na" then we can reuse the work and only implement it one time.

So far this is my opinion.

**Comment by lars18th** [comment]
Hi @andimik ,

>>This other tool is unmaintained

>But there is no need to change it. It will EXACTLY do what we expect.

If you see my recent PRs to the "ts2na" tool then you will discover that current tools will fail (exits) when some error is detected in the source. So using _real-time_ streams this "tsniv2ni" tool isn't robust. My objective is enhance the "ts2**" tool to have the option to run non-stop even with bogus input or errors in the stream. So, if we can support _all_ ETI variants in the same tool then we can use it with any source.

Or if you prefer: why not do it if someone wants to do it?

**Comment by piratfm** [comment]
I actually run that tools 24/7 by simply wrapping long command with that tools around linfinitie loop.

**Comment by piratfm** [comment]
Just imagine that for a some reason Your DVB-card stuck, and the only way to lock it to transponder - is to run zap/stream application once more. Or even to load/unload dvb drivers. Infinitie loop allows You to do that tricks. Also if You look at 

That's very useful when You have very snowy weather like previous week here :)

**Comment by andimik** [comment]
If you would be a broadcaster, you would not rely on open source software.

**Comment by lars18th** [comment]
Hi @piratfm ,

> I actually run that tools 24/7 by simply wrapping long command with that tools around linfinitie loop.

And that's the right solution. However, each time you restart the process you lost part of the bitstream, even parts that can have good (or partially good) data. The best approach in any realtime processing is catching the most errors as you can in lower layers. Then, when a fatal error appears you pass the control to the upper layer.

> Just imagine that for a some reason Your DVB-card stuck, and the only way to lock it to transponder - is to run zap/stream application once more. Or even to load/unload dvb drivers. Infinitie loop allows You to do that tricks.

Yes! And if the tool has some timeout you can exit and catch the error. This makes me think about how to improve even more the `ts2na`. I'm currently improving the robustness of it.

> That's very useful when You have very snowy weather like previous week here :)

Just for that! That's why this tool needs to be improved. :smile: 

Regards.

**Comment by lars18th** [comment]
Hi @andimik 

> If you would be a broadcaster, you would not rely on open source software.

For me it's just a hobby. However, think about the vast amount of open source software that Broadcasters are using! The BBC is a good example of this.

Regards.

**Comment by basicmaster** [comment]
> If you would be a broadcaster, you would not rely on open source software.

Well, this is not correct. At least the German language broadcasters (and also others) make use of and contribute to open source software.

**Comment by rashuk** [comment]
I suspect it was a joke...

At least I hope it was a joke!

If it wasn't it will be easy to find just one radio or TV broadcaster who
does not use free, open source software in mission critical systems.

Good luck - I'll be waiting!

:-D



On 8 Mar 2018 5:32 p.m., "Stefan Pöschel" <notifications@github.com> wrote:

If you would be a broadcaster, you would not rely on open source software.

Well, this is not correct. At least the German language broadcasters (and
also others) make use of and contribute to open source software.

—
You are receiving this because you commented.
Reply to this email directly, view it on GitHub
<https://github.com/piratfm/eti-tools/issues/12#issuecomment-371561825>,
or mute
the thread

**Comment by basicmaster** [comment]
I was rather refering to the general use of OSS....in terms of "mission critical systems" the original statement can be made IMO ;-)

**Comment by rashuk** [comment]
I'm not budging. I am famililar with a lot of infrastructure, in the UK at
least. I see OSS everywhere.


On 8 Mar 2018 18:23, "Stefan Pöschel" <notifications@github.com> wrote:

I was rather refering to the general use of OSS....in terms of "mission
critical systems" the original statement can be made IMO ;-)

—
You are receiving this because you commented.
Reply to this email directly, view it on GitHub
<https://github.com/piratfm/eti-tools/issues/12#issuecomment-371577183>,
or mute
the thread

**Comment by newspaperman** [comment]
here you can test nrk.ts captured from 10719 V 4800 3/4.
It a DVB-S2 Generic Continuous Stream with DVB-GSE content
https://mega.nz/#!MUZkWYSD!RW7fZUR-us4924MxG9jwjdApIkMqTrT1gaImM9Gse8I

**Comment by lars18th** [comment]
Hi @newspaperman ,

> here you can test nrk.ts captured from 10719 V 4800 3/4.

Thank you! We will analyze it. However, from which sat position?

> Inside there are multiple UDP multicast addresses streams containing multiple (propbably) EDI streams

So, I feel it will be Generic Encapsulation Stream (GES, http://en.wikipedia.org/wiki/Generic_Stream_Encapsulation) with IP datagrams that carries EDI bitstreams.

Regards.

**Comment by andimik** [comment]
@lars18th

Please help us here!

**Comment by lars18th** [comment]
Hi @andimik ,

> Please help us here!

I'll do. I have in my current roadmap to work on enhance the "ts2na" tool for _deencapsulate_ more formats. At time, I'm working on ETI-NI(V.11) based on https://github.com/newspaperman/tsniv2ni. After that I'll try with GES+EDI.

Stay on hold!

**Comment by andimik** [comment]
I confirm that there are several DAB+ feeds from Norway. Thanks for the file, as I'm living too South for the beam and my antenna.

These streams are included:

- NRK Reg2 BuTeVe 
http://www.fmlist.org/sendertabelle/dab-ww_more.php?inputLand=NOR&inputEn=F901
- NRK Reg3 SørRog 
http://www.fmlist.org/sendertabelle/dab-ww_more.php?inputLand=NOR&inputEn=F801 
- NRK Reg4 HoSoFj 
http://www.fmlist.org/sendertabelle/dab-ww_more.php?inputLand=NOR&inputEn=F401 
- NRK Reg5 HedOpp 
http://www.fmlist.org/sendertabelle/dab-ww_more.php?inputLand=NOR&inputEn=F501 
- NRK Reg6 TrøMøRo http://www.fmlist.org/sendertabelle/dab-ww_more.php?inputLand=NOR&inputEn=F301 
- NRK Reg7 NoTrFi http://www.fmlist.org/sendertabelle/dab-ww_more.php?inputLand=NOR&inputEn=F601 

Missing (not included in this stream) is 

- NRK Reg1 OsAkØs 
http://www.fmlist.org/sendertabelle/dab-ww_more.php?inputLand=NOR&inputEn=F701

which is for Oslo region.

But I only could see this in the Hex-Editor. Maybe dvblast helps us here?

**Comment by lars18th** [comment]
Hi @andimik ,

> But I only could see this in the Hex-Editor. Maybe dvblast helps us here?

Not needed! You only need to "de-encapsulate" the bitstream. I'll update the tool. Wait to it.

> I'm living too South for the beam and my antenna.

Me too!

> I confirm that there are several DAB+ feeds from Norway

Ok. But from **which** orbital position?
I ask it to update the feeds table.

**Comment by lars18th** [comment]
Hi @andimik ,

If you like to read more about DVB-GES:
http://www.dvb.org/resources/public/factsheets/DVB-GSE_Factsheet.pdf

**Comment by andimik** [comment]
@lars18th

Piratfm already mentioned it here...

**Comment by lars18th** [comment]
> Piratfm already mentioned it here...

OK, so 1.0ºW. However, this NRK capture is from 10719V and in the table is listed 10704V.

I feel we need more captures from 10704V and 10719V.
See http://www.flysat.com/1west.php

And regarding the DVB-GSE I feel it will be more easy to find a generic deencapsulator that translates directly to multicast addresses. Then use them with any **EDI** processor (note is not ETI, but you can check it for example with the ODR-DabMod).

**Comment by lars18th** [comment]
Hi, PR created: https://github.com/piratfm/eti-tools/pull/22

**Comment by andimik** [comment]
DAB Italia and EuroDAB are both in v11 on 12.5 West.

**Comment by lars18th** [comment]
Hi @andimik ,

> DAB Italia and EuroDAB are both in v11 on 12.5 West.

So, please provide dumps for analyze them.
After that we can update the table.

> Hi, PR created: #22

still waiting for... :cry:

**Comment by andimik** [comment]
They work. Already analyzed. PIDs are 777 and 1025. 12518 H, see http://www.flysat.com/e12wb.php

**Comment by andimik** [comment]
Signal is very strong here in Central Europe, 60 cm is enough.

**Comment by andimik** [comment]
@newspaperman

Which addresses are used for NRK and how did you find out?

Wireshark?

**Comment by andimik** [comment]
Here is a dump from 12.5 West:

[12517_dab.ts.zip](https://github.com/piratfm/eti-tools/files/1822870/12517_dab.ts.zip)

# For 12C DAB Italia

```
$ tsniv2ni 777 < 12517_dab.ts | ni2http --list
 (0x5009)
 0 : Deejay 30 Songs  (0x5283) Pri subch=20 start=756 CUs= 36 PL=eep-3a bitrate=48 DAB+
 1 : 105 DAB          (0x5286) Pri subch=11 start=348 CUs= 36 PL=eep-3a bitrate=48 DAB+
 2 : Radio 24 +1      (0x5282) Pri subch=19 start=720 CUs= 36 PL=eep-3a bitrate=48 DAB+
 3 : Kc2Test          (0x5288) Pri subch=13 start=456 CUs= 72 PL=eep-3a bitrate=96 DAB+
 4 : * RDS *          (0x5264) Pri subch= 8 start=312 CUs= 36 PL=eep-3a bitrate=48 DAB+
 5 : Kc1Test          (0x5280) Pri subch=12 start=384 CUs= 72 PL=eep-3a bitrate=96 DAB+
 6 : R101             (0x5215) Pri subch= 4 start=156 CUs= 36 PL=eep-3a bitrate=48 DAB+
 7 : M DUE O          (0x5233) Pri subch= 6 start=240 CUs= 36 PL=eep-3a bitrate=48 DAB+
 8 : M DUE O DANCE    (0x5287) Pri subch=18 start=696 CUs= 24 PL=eep-3a bitrate=32 DAB+
 9 : Kc3Test          (0x5289) Pri subch=14 start=528 CUs= 72 PL=eep-3a bitrate=96 DAB+
10 : Capital Funky    (0x5285) Pri subch=17 start=672 CUs= 24 PL=eep-3a bitrate=32 DAB+
11 : Radio Radicale   (0x5210) Pri subch= 2 start= 36 CUs= 72 PL=eep-3a bitrate=96 DAB+
12 : Deejay           (0x5214) Pri subch= 3 start=108 CUs= 48 PL=eep-3a bitrate=64 DAB+
13 : Capital          (0x5219) Pri subch= 5 start=192 CUs= 48 PL=eep-3a bitrate=64 DAB+
14 : RMALB.IA         (0x52cc) Pri subch=15 start=600 CUs= 36 PL=eep-3a bitrate=48 DAB+
15 : Radio Maria      (0x51cc) Pri subch= 1 start=  0 CUs= 36 PL=eep-3a bitrate=48 DAB+
16 : Radio 24         (0x5245) Pri subch= 7 start=276 CUs= 36 PL=eep-3a bitrate=48 DAB+
17 : * RDS * Relax    (0x5281) Pri subch=16 start=636 CUs= 36 PL=eep-3a bitrate=48 DAB+

```

# For 12A (in Milan 12D) EuroDAB Italia

```
$ tsniv2ni 1025 < 12517_dab.ts | ni2http --list
EuroDAB Italia   (0x5003)
 0 : RVaticana Ita +  (0x410e) Pri subch= 4 start=198 CUs= 72 PL=eep-2a bitrate=72 DAB+
 1 : RTL Best         (0x5298) Pri subch= 5 start=270 CUs= 72 PL=eep-2a bitrate=72 DAB+
 2 : RTL 102.5        (0x5218) Pri subch= 6 start=342 CUs= 72 PL=eep-2a bitrate=72 DAB+
 3 : RTL Romeo&Juliet (0x5296) Pri subch=10 start=486 CUs= 54 PL=eep-3a bitrate=72 DAB+
 4 : RTL ViaRadio     (0x5294) Pri subch=11 start=540 CUs= 72 PL=eep-2a bitrate=72 DAB+
 5 : RadioFreccia     (0x5293) Pri subch=12 start=612 CUs= 72 PL=eep-2a bitrate=72 DAB+
 6 : RTL Guardia Cost (0x5295) Pri subch= 1 start=  0 CUs= 54 PL=eep-3a bitrate=72 DAB+
 7 : Radio Test       (0x5299) Pri subch=13 start=684 CUs= 72 PL=eep-2a bitrate=72 DAB+
 8 : Radio KissKiss   (0x5225) Pri subch= 8 start=414 CUs= 72 PL=eep-2a bitrate=72 DAB+
 9 : Radio Padania    (0x5276) Pri subch= 2 start= 54 CUs= 72 PL=eep-2a bitrate=72 DAB+
10 : Radio Italia SMI (0x5220) Pri subch= 3 start=126 CUs= 72 PL=eep-2a bitrate=72 DAB+
```

**Comment by mrwish7** [comment]
There is apparently a new DAB source on Eutelsat 3.1°E 12734V 16751 3/5

PID 1010 carrying ERT DAB+ (Greece). It’s running at ~900kbps so it is probably v11?

**Comment by andimik** [comment]
Strange, I thought they only have one transmitter (so far). Could you upload a dump of this PID (10 megabyte are enough)? Don't know if I can find a free minute.

**Comment by mrwish7** [comment]
Apparently another transmitter has opened in the South of Greece.

I've just tried the tsniv2ni tool and it is carrying v11 ETI with the ERT DAB+ ensemble!

./tsniv2ni 1010 < 12734V_1010.ts | ./ni2http --list
 (0xe000)
 0 : Trito            (0xc043) Pri subch= 2 start=272 CUs=136 PL=eep-2a bitrate=136 DAB+
 1 : Era Sport        (0xc044) Pri subch= 3 start=408 CUs=128 PL=eep-2a bitrate=128 DAB+
 2 : Kosmos           (0xc045) Pri subch= 4 start=536 CUs=136 PL=eep-2a bitrate=136 DAB+
 3 : Voice Of Greece  (0xc046) Pri subch= 5 start=672 CUs= 96 PL=eep-2a bitrate=96 DAB+
 4 : Era 7            (0xc047) Pri subch= 6 start=768 CUs= 64 PL=eep-2a bitrate=64 DAB+
 5 : Proto            (0xc041) Pri subch= 0 start=  0 CUs=136 PL=eep-2a bitrate=136 DAB+
 6 : Deytero          (0xc042) Pri subch= 1 start=136 CUs=136 PL=eep-2a bitrate=136 DAB+

**Comment by andimik** [comment]
Yes, confirm, I also have tried it.

```
$ tsniv2ni/tsniv2ni 1010 < Eutelsat\ 3East\ 12734\ V\ 03-22\ 19-03-15.ts | ni2http --list
ERT DAB          (0xe000)
 0 : Era 7            (0xc047) Pri subch= 6 start=768 CUs= 64 PL=eep-2a bitrate=64 DAB+
 1 : Proto            (0xc041) Pri subch= 0 start=  0 CUs=136 PL=eep-2a bitrate=136 DAB+
 2 : Deytero          (0xc042) Pri subch= 1 start=136 CUs=136 PL=eep-2a bitrate=136 DAB+
 3 : Trito            (0xc043) Pri subch= 2 start=272 CUs=136 PL=eep-2a bitrate=136 DAB+
 4 : Era Sport        (0xc044) Pri subch= 3 start=408 CUs=128 PL=eep-2a bitrate=128 DAB+
 5 : Kosmos           (0xc045) Pri subch= 4 start=536 CUs=136 PL=eep-2a bitrate=136 DAB+
 6 : Voice Of Greece  (0xc046) Pri subch= 5 start=672 CUs= 96 PL=eep-2a bitrate=96 DAB+

```

[Eutelsat 3East 12734 V 03-22 19-03-15.ts.zip](https://github.com/piratfm/eti-tools/files/1838737/Eutelsat.3East.12734.V.03-22.19-03-15.ts.zip)

**Comment by newspaperman** [comment]
@mrwish7 that's a really nice catch! 
I think we should also scan the French/Italian multistream muxes on 5°West + 12.5°West and the RAI + SRG SSR muxes on 13°East.
Perhaps there are even hidden DAB muxes on 19.2°East?

@andimik: in the nrk stream you can find the multicast addresses 0xef 0xc0 (239.192.x.x)

**Comment by andimik** [comment]
I tried 12.5 W, but no luck so far.

**Comment by piratfm** [comment]
BTW, the more-less truly way to detect DAB feeds - is that they PID's taking bandwidth somewhere in the middle between video's and audio's: more than 800kbps and less than 1.8 mbps. So if You see pid in the mux with such bitrate - it's high chance that it can be DAB mux.

**Comment by andimik** [comment]
BTW: @mrwish7 

Thanks for joining Github even today. I just told a DX friend of me that Greece DAB is on Satellite, he did not believe me. But the 2nd transmitter seems really the case.

Can you tell me more where the new transmitter is? Want to tell the admin to change DABLIST / FMLIST, see http://www.fmlist.org/sendertabelle/dab-ww_more.php?inputLand=GRC&inputEn=GRC1 for instance.

**Comment by mrwish7** [comment]
@andimik I'm not sure where the extra DAB transmitter is, I was given the details about this by a contact in Greece on satellites.co.uk who had found the PID and wondered if it was possible to decapsulate it. He just told me that a second transmitter has opened in Southern Greece

**Comment by mrwish7** [comment]
@newspaperman I've just checked 10971H and 11526H on 13°E (both the SRG SSR transponders) - there doesn't seem to be anything that looks like ETI on either of those. All the streams around that bitrate point to the TV channels (Audio and HBBtv).

I've checked 10992 and 11804 for Rai, and also no sign of anything on these ones, but there may be some on 5W!

**Comment by andimik** [comment]
No, on the multistream transponders there are just the DVB-T feeds for almost all regions. Aosta, TAA and FVG are not there, unfortunately :-( 
Other transponders on that satellite were too weak for me yesterday for my ad hoc solution...

**Comment by andimik** [comment]
Maybe NRK works with https://github.com/mmalecki/multicat/blob/master/trunk/README

**Comment by rylecqfd** [comment]
Hi,
on 28.2E 11425 H 27500 QPSK 2/3, pid 1062 & 1063 you can find two MUX that seem to be the same that are on 4.5E (I can't receive those so I can't verify): "D1 National" and "SDL National".

**Comment by andimik** [comment]
Maybe they moved from 9 East?

**Comment by mrwish7** [comment]
Yes these on 28.2E 11425H are the same as the ones on 4.8E -

1062 D1 National (11D/12A)
1063 SDL National (11A)

Just the BBC multiplex (1061) is missing. These have both been on 28.2E for the last 4 months at least.

**Comment by andimik** [comment]
I told you, they moved. On 9 East there only were 2 streams

**Comment by andimik** [comment]
@mrwish7 

Could you check the SIDs? According to http://de.kingofsat.net/tp.php?tp=732 the PIDs are different.

**Comment by mrwish7** [comment]
@andimik SIDs on 11425H are 10585 (D1 DAB) and 10590 (SDL nATL). PIDs 1062 and 1063 as on 4.8E.

**Comment by andimik** [comment]
Ok, understood. As this is the UK, I will not try it at all.

**Comment by andimik** [comment]
Why? It was in the PR! 

I've added 28.2 East.

**Comment by andimik** [comment]
In the meanwhile I have tried other satellite positions, but no luck. There is still a PR to be merged...

**Comment by andimik** [comment]
Regarding NRK: On a French forum I found these screenshots

http://forum.satelliweb.com/viewtopic.php?f=16&t=11951&start=20

https://image.ibb.co/d7vvOS/0_8_W_1803121618_10719_V.jpg
http://pimg.imagesia.com/fichiers/1g0/capture-d-ecran-816-_imagesia-com_1g04d.png

**Comment by andimik** [comment]
![br_swr_transponder](https://user-images.githubusercontent.com/24510556/39740016-0db70f1a-5294-11e8-952a-2ae4e0462636.png)

I found 6 German DAB muxes just by chance.

They are on 7 East, DVB-IP, PID 101, 12572V, SR 6805, DVB-S2/QPSK 2/3. Seems to be the same technology like for NRK. There are 6 IP-Addresses to be found.

[swr_br_dab.7z.zip](https://github.com/piratfm/eti-tools/files/1982473/swr_br_dab.7z.zip)
Rename it to 7z
[swr_br.zip](https://github.com/piratfm/eti-tools/files/1982478/swr_br.zip)

The table is already updated ...

**Comment by andimik** [comment]
@newspaperman 
Could you share again a dump of the complete TS on 1 West? I realized that TSReader only works when you open the complete MPEG2 compatible TS, not the PID alone.

@lars18th 
Do you know how it works to make them hearable? Does `dvbstream` or `dvblast` and `edi2eti` help here? In TS Reader I could export all 6 Adresses to one file (ending `*.ip`). So basically you can split it.

**Comment by piratfm** [comment]
I suggest that dvbnet device must be used, so it would be like another one ethernet interface, where all that multicast strams must be seen.

More info on dvbnet: https://linuxtv.org/wiki/index.php/InternetDVB

**Comment by andimik** [comment]
Ok, many thanks. I'll try it at the weekend. 

And then I should call `edi2eti` ? (As I assume it's EDI.)

Seems `edi2eti` only accepts data from an IP address, not from a file? 
Is [ip:port] mandatory?

**Comment by piratfm** [comment]
BTW, dvbnet - is already included in dvb-apps package.
Yes, EDI is received only from a socket due it's network-related nature.

**Comment by andimik** [comment]
Well, I'm a network newbie (I don't know what udp, mpe, ule and so on is) and only a consumer.

I tried it right now. Seems I have to do it live with a sat signal. A file is not working. Help says this is hardcoded.

`dvbstream -f 12572000 -s 6805 8192 -p V -D 2 -o -m -udp | vlc`
(my 7E dish is on DiSEqC 3, and I pipe it to VLC in order to avoid the output)
(do you know a better solution?)

`dvbnet` is running

I see a new wired connection in networks, but I cannot connect.

```
sudo dvbnet -l                                                                                                  
                                                                                                                                      
DVB Network Interface Manager                                                                                                         
Copyright (C) 2003, TV Files S.p.A                                                                                                    
                                                                                                                                      
Query DVB network interfaces:                                                                                                         
-----------------------------                                                                                                         
Found device 0: interface dvb0_0, listening on PID 101, encapsulation MPE
-----------------------------
Found 1 interface(s).
```

```
edi2eti -a 239.16.242.15
ZeroMQ:disabled, FEC:disabled
[05/09/18 21:04:25] receiving from: 239.16.242.15:5004...
[05/09/18 21:04:26] Stream Disappears!
```
Is 5004 the default port?

**Comment by piratfm** [comment]
Yes, 5004 is default port,
Please install "tcpdump" application and then run it like this:
```
tcpdump -ni dvbnet0_0
```
After that Your console must display a lot of multicast packets from that dvb0_0 interface. As alternative, You can use GUI application, called Wireshark, and the newest version even able to do more deep analyze and parse EDI streams.

**Comment by andimik** [comment]
With `tcpdump -ni dvb0_0` I get these lines:

```
16:38:38.178891 IP 172.16.242.13.4096 > 239.16.242.13.60013: UDP, length 1170
16:38:38.178897 IP 172.16.242.11.4096 > 239.16.242.11.60011: UDP, length 1197
16:38:38.178899 IP 172.16.242.17.4096 > 239.16.242.17.60017: UDP, length 1263
16:38:38.182640 IP 172.16.242.13.4096 > 239.16.242.13.60013: UDP, length 1170
16:38:38.182645 IP 172.16.242.11.4096 > 239.16.242.11.60011: UDP, length 1197
16:38:38.182646 IP 172.16.242.17.4096 > 239.16.242.17.60017: UDP, length 1263
16:38:38.186292 IP 172.16.242.15.4096 > 239.16.242.15.60015: UDP, length 934
16:38:38.186296 IP 10.48.10.150.4096 > 239.132.1.50.5004: UDP, length 1244
16:38:38.186299 IP 172.16.242.13.4096 > 239.16.242.13.60013: UDP, length 1168
16:38:38.189902 IP 172.16.242.11.4096 > 239.16.242.11.60011: UDP, length 1197
16:38:38.189908 IP 172.16.242.17.4096 > 239.16.242.17.60017: UDP, length 1261

```
but edi2eti does not receive any data (Message: `Stream dissapears`). Do I have to tell edi2eti to use `dvb0_0`? Or is this default?

Is 600xx the port?
Seems only SWR is on 5004.
Should I enable FEC?
Do I have to use the 172.xxx address or the 239.xxx address?

I will also try to start dvbnet with -U.

**Comment by andimik** [comment]
I also tried to use the edi input in ODR-DABMod, but no chance as well.

**Comment by piratfm** [comment]
Yes, that's a port numbers that You suggested. I added that numbers to readme. You need to specify it as argument for edi2eti, like this: 239.16.242.13:60013

**Comment by piratfm** [comment]
Also, You need to force default route to multicast interface. Just run this command:
```
route add -net 224.0.0.0 netmask 240.0.0.0 dev dvb0_0
```

And all apps will listen for multicast from that interface/

**Comment by andimik** [comment]
No, same message

> Stream Disappears

After I press ctrl+c the message is

> Stream Appears

Tcpdump still tells me all IP addresses

**Comment by newspaperman** [comment]
Perhaps you need to set an IP address for the virtual network device:
sudo ifconfig dvb0_0 192.168.3.3

And it might be necessary to flush ip tables:
sudo iptables -t Nat -F
sudo iptables -F

**Comment by andimik** [comment]
I'm giving up.

I've also tried

`sudo ifconfig dvb0_0 hw ether 00:22:ab:c0:47:17 192.168.43.199 netmask 255.255.255.255 promisc allmulti up`


```
$ route -n
Kernel-IP-Routentabelle
Ziel            Router          Genmask         Flags Metric Ref    Use Iface
0.0.0.0         192.168.43.1    0.0.0.0         UG    600    0        0 wlp2s0
169.254.0.0     0.0.0.0         255.255.0.0     U     1000   0        0 wlp2s0
192.168.43.0    0.0.0.0         255.255.255.0   U     600    0        0 wlp2s0
224.0.0.0       0.0.0.0         240.0.0.0       U     0      0        0 dvb0_0

```

```
$ sudo edi2eti 239.16.242.11:60011
[sudo] Passwort für xxx: 
ZeroMQ:disabled, FEC:disabled
[05/15/18 20:39:40] receiving from: 239.16.242.11:60011...
[05/15/18 20:39:40] Stream Disappears!

```


```
$ dmesg | grep dvb
[    8.038393] dvb-usb: found a 'TurboSight TBS 5927 DVB-S/S2' in cold state, will try to load a firmware
[    8.038682] dvb-usb: downloading firmware from file 'dvb-usb-tbsqbox-id5927.fw'
[    8.192281] dvb-usb: found a 'TurboSight TBS 5927 DVB-S/S2' in warm state.
[    8.192586] dvb-usb: will pass the complete MPEG2 transport stream to the software demuxer.
[    8.192767] dvbdev: DVB: registering new adapter (TurboSight TBS 5927 DVB-S/S2)
[    8.617157] dvb-usb: MAC address: 00:22:ab:c0:47:17
[    8.791531] rc rc0: lirc_dev: driver dvb_usb_tbs5927 registered at minor = 0
[    8.791535] dvb-usb: schedule remote query interval to 150 msecs.
[    8.791539] dvb-usb: TurboSight TBS 5927 DVB-S/S2 successfully initialized and connected.
[   72.206591] dvb_net: created network interface dvb0_0
[   72.227473] IPv6: ADDRCONF(NETDEV_UP): dvb0_0: link is not ready
[  190.812388] device dvb0_0 entered promiscuous mode

```
```
$ femon
FE: TurboSight TBS 5927 DVB-S/S2 (DVBS)
status SCVYL | signal a690 | snr 87d0 | ber 00000000 | unc 00000000 | FE_HAS_LOCK
status SCVYL | signal a690 | snr 8918 | ber 00000000 | unc 00000000 | FE_HAS_LOCK
status SCVYL | signal a690 | snr 8918 | ber 00000000 | unc 00000000 | FE_HAS_LOCK
```


```
 sudo tcpdump -i dvb0_0
tcpdump: verbose output suppressed, use -v or -vv for full protocol decode
listening on dvb0_0, link-type EN10MB (Ethernet), capture size 262144 bytes
20:42:42.516186 IP 172.16.242.11.4096 > 239.16.242.11.60011: UDP, length 1197
20:42:42.516196 IP 172.16.242.17.4096 > 239.16.242.17.60017: UDP, length 1263
20:42:42.516198 IP 10.48.10.150.4096 > 239.132.1.50.5004: UDP, length 1245
20:42:42.519922 IP 172.16.242.13.4096 > 239.16.242.13.60013: UDP, length 1170
20:42:42.519930 IP 172.16.242.11.4096 > 239.16.242.11.60011: UDP, length 1197
20:42:42.519932 IP 172.16.242.17.4096 > 239.16.242.17.60017: UDP, length 1263
20:42:42.519934 IP 172.16.242.13.4096 > 239.16.242.13.60013: UDP, length 1170
20:42:43.572337 IP 10.48.10.150.4096 > 239.132.1.50.5004: UDP, length 1244
^C20:42:44.795655 IP 172.16.242.15.4096 > 239.16.242.15.60015: UDP, length 934
```

Maybe someone else can investige, I'm a complete newbie concerning network.

**Comment by andimik** [comment]
You find it here: 
https://we.tl/dDd14uSkvO
ca. 200 MB
This is a tcpdump from 7 East, DAB streams from Germany 
This is a zipped 7z file, Length 5:45 min.

I don't know how to switch to English in Wireshark ...

But it seems, I shall help them to translate it into better (and error-free) German.
> 
> Erstellt von Wireshark 2.6.0 (v2.6.0-0-gc7239f02)
> 
> Datei
> 
> Name:
> F:\home\andreas\dumpfile.pcap
> Länge:
> 266 MB
> Format:
> Wireshark/tcpdump/... - pcap
> Datenkapselung:
> Ethernet
> Schnappschusslänge:
> 2000
> 
> Zeit
> 
> Erstes Paket:
> 2018-05-15 22:23:06
> Letztes Paket:
> 2018-05-15 22:28:51
> Zeitspanne:
> 00:05:45
> 
> Mitschnitt
> 
> Hardware:
> Unbekannt
> BS:
> Unbekannt
> Applikation:
> Unbekannt
> 
> Schnittstellen
> 
> Schnittstelle
> Verworfene Pakete
> Mitschnittfilter
> Linktyp
> Paketgrößenlimit
> Unbekannt
> Unbekannt
> Unbekannt
> Ethernet
> 2000 Byte
> 
> Statistik
> 
> Messwerte
> Aufgezeichnet
> Angezeigt
> Markiert
> Pakete
> 215593
> 215593 (100.0%)
> —
> Zeitspanne, s
> 345.059
> 345.059
> —
> Durchschnittliche pps
> 624.8
> 624.8
> —
> Durschnittliche Paketgröße, B
> 1220
> 1220
> —
> Byte
> 263076529
> 263076529 (100.0%)
> 0
> Durschnittliche Byte/s
> 762 k
> 762 k
> —
> Durschnittliche Bit/s
> 6099 k
> 6099 k
> —
> 
>

**Comment by newspaperman** [comment]
Seems the ifconfig command to set an IP address did not work. Do you get an error message with the command a told you?

Wireshark works in English if you start it from she'll like this:
LANG=c wireshark

**Comment by newspaperman** [comment]
with these settings I get data:
dvbnet -p 101
ifconfig dvb0_0 192.168.238.238 hw ether 00:01:02:03:04:05 promisc up
ifconfig dvb0_0 192.168.238.238 hw ether 00:01:02:03:04:05 promisc up
route add -net 224.0.0.0 netmask 240.0.0.0 dev dvb0_0
echo 0 > /proc/sys/net/ipv4/conf/all/rp_filter
echo 0 > /proc/sys/net/ipv4/conf/dvb0_0/rp_filter

however it seems not to be edi:
ZeroMQ:disabled, FEC:enabled
[05/26/18 01:06:38] receiving from: 239.16.242.13:60013...
[05/26/18 01:06:38] Initialise next pseq to 5598
[05/26/18 01:06:38] EDI-PF: Too many errors to reconstruct AF
[05/26/18 01:06:38] EDI-PF: undecodeable pseq: 5599 with fragments: 3/3
[05/26/18 01:06:38] EDI-PF: Too many errors to reconstruct AF
[05/26/18 01:06:38] EDI-PF: undecodeable pseq: 5600 with fragments: 3/3
[05/26/18 01:06:38] EDI-PF: Too many errors to reconstruct AF
[05/26/18 01:06:38] EDI-PF: undecodeable pseq: 5601 with fragments: 3/3

**Comment by andimik** [comment]
Ok, Thanks. I have changed the Makefile and now compiled with FEC.

If you use 239.16.242.11:60011 or 239.16.242.15:60015 you will get at least a kind of datastream output. But it is still full of errors.

**Comment by andimik** [comment]
SUCCESS!!!

But not with eti-tools, but with ODR-DabMod
```
[input]
transport=edi
source=udp://@239.16.242.15:60015

[modulator]
gainmode =1
rate=2048000
digital_gain=0.8

[output]
output=file

[fileoutput]
format=u8
filename=/dev/stdout
```
Then I start `odr-dabmod [thisinifile.ini] | qt-dab`

And in qt-dab you use "file input .raw" and open `/dev/stdin`

Then you can hear at least a sound, but the stream contains errors too.

> 
> WARN  EDI AF Packet sequence error
>       pseq 30536 timed out
> WARN  EDI AF Packet sequence error
>        Reinit
>       Initialise next_pseq to 30570
> WARN  EDI AF Packet sequence error
>       pseq 30572 timed out
>        Reinit
>       Initialise next_pseq to 30588
> WARN  EDI AF Packet sequence error
>       pseq 30590 timed out
> WARN  EDI AF Packet sequence error
>        Reinit

![obb_odrdabmod](https://user-images.githubusercontent.com/24510556/40575112-c6bf42a4-60de-11e8-92d6-15110c1bce5c.png)

**Comment by andimik** [comment]
So now I can listen at least to 3 DAB streams on this transponder :-) The upper one and these two:

![grafik](https://user-images.githubusercontent.com/24510556/40575852-f23487a6-60ec-11e8-81eb-1f2c1dbb04aa.png)
config in the odr-dabmod file: `source=udp://@239.16.242.11:60011`


![grafik](https://user-images.githubusercontent.com/24510556/40575861-28dd3230-60ed-11e8-9831-8452799adc49.png)
`source=udp://@239.16.242.14:60014 `

@mpbraendli 

Do you know why there are errors?

```
stream opened
stream started
      pseq 47543 timed out
      pseq 47544 timed out
      pseq 47545 timed out
      pseq 47546 timed out
      pseq 47547 timed out
      pseq 47548 timed out
      pseq 47549 timed out
      pseq 47550 timed out
      pseq 47551 timed out
      pseq 47552 timed out
      pseq 47553 timed out
      pseq 47554 timed out
      pseq 47555 timed out
      pseq 47556 timed out
      pseq 47557 timed out

```

@piratfm 

I will open a new issue as this now takes too long for loading in the browser ...

**Comment by newspaperman** [comment]
there seems to be a bug in pf_parser. We have the case that that ETI stream has no FEC.
I think in this case in function decodePFTFrargs bytesCollected is not set and the function always returns false.

**Comment by newspaperman** [comment]
@piratfm would a wireshark trace help you to resolve this issue?

**Comment by andimik** [comment]
You could use tcpreplay for that.

https://linux.die.net/man/1/tcpreplay

**Comment by newspaperman** [comment]
@andimik:
can you please check if this patch will fix it? Atm I don't have any sat reception at all, seems my dish got disaligend due to a heavy storm :(
diff --git a/pf_parser.c b/pf_parser.c
index 46e8cd1..f278c90 100644
--- a/pf_parser.c
+++ b/pf_parser.c
@@ -49,9 +49,9 @@ int HandlePFPacket(edi_handler_t *h, uint8_t *edi_pkt, size_t pktsize)
     h->pf._Plen = read_16b(edi_pkt+index) & 0x3FFF; index += 2;
 
     const size_t required_len = PFPACKET_HEADER_LEN +
-        (h->pf._FEC ? 1 : 0) +
-        (h->pf._Addr ? 2 : 0) +
-        2; // CRC
+        (h->pf._FEC ? 2 : 0) +
+        (h->pf._Addr ? 4 : 0) +
+        0; // CRC
     if (pktsize < required_len) {
         return 0;
     }

**Comment by andimik** [comment]
Do I need to save this to a file in the eti-tools directory and execute it there?

**Comment by newspaperman** [comment]
save it as my.patch in the folder andt then execute
patch -p1 -i my.patch

**Comment by andimik** [comment]
No, did not work. Still too many errors.

**Comment by piratfm** [comment]
I fixed error with last packed (that can be smaller in raw AF mode), now it decoding ok.

i was able to hear radio by running this commands:

```
sudo route add -net 10.48.10.0/24 dev lo
sudo route add -net 172.16.242.0/24 dev lo
sudo route add -net 224.0.0.0 netmask 240.0.0.0 dev lo
sudo tcpreplay -d 1 -i lo dumpfile.pcap &
./edi2eti -a -o /dev/stdout 239.16.242.11:60011 | ./ni2http --list
./edi2eti -a -o /dev/stdout 239.16.242.11:60011 | ./ni2http -s 0x141a | ffplay -
```

**Comment by andimik** [comment]
yes, confirmed

MANY THANKS. :-) 

I will close this issue now as said before (topic too long now).

**Comment by jay-to-the-dee** [comment]
Looks like the UK streams on Astra 28.2 have gone at 11425H :( Can anyone else confirm this is definitely the case and the format hasn't just changed or if it's gone to a completely different transponder?
